{
  "version": "research-real-v2",
  "status": "curated-real-source-metadata",
  "annotationPolicy": "New independently curated real-source metadata. Gold answers are bounded propositions and are never changed to match implementation output. V2 holdout is frozen before capability tuning.",
  "splitPolicy": {
    "development": "15 new cases for capability development.",
    "holdout": "5 new cases frozen for one-shot generalization evaluation.",
    "holdoutInfluencedTuning": false
  },
  "cases": [
    {
      "caseId": "v2-bart",
      "split": "development",
      "title": "BART: Denoising Sequence-to-Sequence Pre-training for Natural Language Generation, Translation, and Comprehension",
      "authors": [],
      "category": "objective",
      "source": {
        "arxivId": "1910.13461",
        "arxivVersion": "v1",
        "absUrl": "https://arxiv.org/abs/1910.13461v1",
        "pdfUrl": "https://arxiv.org/pdf/1910.13461v1",
        "paperRevisionDate": "2019-10-31",
        "repositoryUrl": "https://github.com/facebookresearch/fairseq",
        "repositoryCommitSha": "3d262bb25690e4eb2e7d3c1309b1e9c406ca4b99",
        "repositoryCommitDate": null,
        "paperSha256": null,
        "paperSha256Status": "PENDING_ACQUISITION",
        "artifactPolicy": "cache_only_no_redistribution",
        "temporalAlignment": "UNKNOWN"
      },
      "tasks": [
        {
          "taskId": "v2-bart-task",
          "query": "Which corruption objective is used during pretraining?",
          "expectedStatus": "SUPPORTED",
          "expectedAnswer": {
            "objective": "text infilling"
          },
          "expectedSourceClass": [
            "paper"
          ],
          "expectedLocator": "paper evidence",
          "annotationRationale": "Independently curated bounded proposition for the new V2 corpus."
        }
      ]
    },
    {
      "caseId": "v2-simcse",
      "split": "development",
      "title": "SimCSE: Simple Contrastive Learning of Sentence Embeddings",
      "authors": [],
      "category": "objective",
      "source": {
        "arxivId": "2011.00677",
        "arxivVersion": "v1",
        "absUrl": "https://arxiv.org/abs/2011.00677v1",
        "pdfUrl": "https://arxiv.org/pdf/2011.00677v1",
        "paperRevisionDate": "2020-11-02",
        "repositoryUrl": "https://github.com/google-research/simclr",
        "repositoryCommitSha": "383d4143fd8cf7879ae10f1046a9baeb753ff438",
        "repositoryCommitDate": null,
        "paperSha256": null,
        "paperSha256Status": "PENDING_ACQUISITION",
        "artifactPolicy": "cache_only_no_redistribution",
        "temporalAlignment": "UNKNOWN"
      },
      "tasks": [
        {
          "taskId": "v2-simcse-task",
          "query": "What learning signal trains SimCSE representations?",
          "expectedStatus": "SUPPORTED",
          "expectedAnswer": {
            "objective": "contrastive learning"
          },
          "expectedSourceClass": [
            "paper"
          ],
          "expectedLocator": "paper evidence",
          "annotationRationale": "Independently curated bounded proposition for the new V2 corpus."
        }
      ]
    },
    {
      "caseId": "v2-switch",
      "split": "development",
      "title": "Switch Transformers: Scaling to Trillion Parameter Models with Simple and Efficient Sparsity",
      "authors": [],
      "category": "architecture",
      "source": {
        "arxivId": "2101.03961",
        "arxivVersion": "v1",
        "absUrl": "https://arxiv.org/abs/2101.03961v1",
        "pdfUrl": "https://arxiv.org/pdf/2101.03961v1",
        "paperRevisionDate": "2021-01-11",
        "repositoryUrl": null,
        "repositoryCommitSha": null,
        "repositoryCommitDate": null,
        "paperSha256": null,
        "paperSha256Status": "PENDING_ACQUISITION",
        "artifactPolicy": "cache_only_no_redistribution",
        "temporalAlignment": "UNKNOWN"
      },
      "tasks": [
        {
          "taskId": "v2-switch-task",
          "query": "How does Switch distribute tokens among experts?",
          "expectedStatus": "SUPPORTED",
          "expectedAnswer": {
            "architecture": "sparse mixture of experts"
          },
          "expectedSourceClass": [
            "paper"
          ],
          "expectedLocator": "paper evidence",
          "annotationRationale": "Independently curated bounded proposition for the new V2 corpus."
        }
      ]
    },
    {
      "caseId": "v2-palm",
      "split": "development",
      "title": "PaLM: Scaling Language Modeling with Pathways",
      "authors": [],
      "category": "systems",
      "source": {
        "arxivId": "2204.02311",
        "arxivVersion": "v1",
        "absUrl": "https://arxiv.org/abs/2204.02311v1",
        "pdfUrl": "https://arxiv.org/pdf/2204.02311v1",
        "paperRevisionDate": "2022-04-05",
        "repositoryUrl": "https://github.com/google-research/t5x",
        "repositoryCommitSha": "2045b332cf19887885a74ef1bd6b2adb2a7ca634",
        "repositoryCommitDate": null,
        "paperSha256": null,
        "paperSha256Status": "PENDING_ACQUISITION",
        "artifactPolicy": "cache_only_no_redistribution",
        "temporalAlignment": "UNKNOWN"
      },
      "tasks": [
        {
          "taskId": "v2-palm-task",
          "query": "What parallel computation approach is used to train PaLM?",
          "expectedStatus": "SUPPORTED",
          "expectedAnswer": {
            "parallelism": "data parallelism"
          },
          "expectedSourceClass": [
            "paper"
          ],
          "expectedLocator": "paper evidence",
          "annotationRationale": "Independently curated bounded proposition for the new V2 corpus."
        }
      ]
    },
    {
      "caseId": "v2-flamingo",
      "split": "development",
      "title": "Flamingo: a Visual Language Model for Few-Shot Learning",
      "authors": [],
      "category": "multimodal",
      "source": {
        "arxivId": "2204.14198",
        "arxivVersion": "v1",
        "absUrl": "https://arxiv.org/abs/2204.14198v1",
        "pdfUrl": "https://arxiv.org/pdf/2204.14198v1",
        "paperRevisionDate": "2022-04-28",
        "repositoryUrl": "https://github.com/OpenGVLab/InternVL",
        "repositoryCommitSha": "2410d1dbf208f0e799459aff9376e5747dbf41a2",
        "repositoryCommitDate": null,
        "paperSha256": null,
        "paperSha256Status": "PENDING_ACQUISITION",
        "artifactPolicy": "cache_only_no_redistribution",
        "temporalAlignment": "UNKNOWN"
      },
      "tasks": [
        {
          "taskId": "v2-flamingo-task",
          "query": "How does Flamingo connect visual inputs to language modeling?",
          "expectedStatus": "SUPPORTED",
          "expectedAnswer": {
            "formulation": "cross-attention"
          },
          "expectedSourceClass": [
            "paper"
          ],
          "expectedLocator": "paper evidence",
          "annotationRationale": "Independently curated bounded proposition for the new V2 corpus."
        }
      ]
    },
    {
      "caseId": "v2-blip2",
      "split": "development",
      "title": "BLIP-2: Bootstrapping Language-Image Pre-training with Frozen Image Encoders and Large Language Models",
      "authors": [],
      "category": "multimodal",
      "source": {
        "arxivId": "2301.12597",
        "arxivVersion": "v1",
        "absUrl": "https://arxiv.org/abs/2301.12597v1",
        "pdfUrl": "https://arxiv.org/pdf/2301.12597v1",
        "paperRevisionDate": "2023-01-30",
        "repositoryUrl": null,
        "repositoryCommitSha": null,
        "repositoryCommitDate": null,
        "paperSha256": null,
        "paperSha256Status": "PENDING_ACQUISITION",
        "artifactPolicy": "cache_only_no_redistribution",
        "temporalAlignment": "UNKNOWN"
      },
      "tasks": [
        {
          "taskId": "v2-blip2-task",
          "query": "What intermediary module bridges the frozen vision encoder and language model?",
          "expectedStatus": "SUPPORTED",
          "expectedAnswer": {
            "component": "Q-Former"
          },
          "expectedSourceClass": [
            "paper"
          ],
          "expectedLocator": "paper evidence",
          "annotationRationale": "Independently curated bounded proposition for the new V2 corpus."
        }
      ]
    },
    {
      "caseId": "v2-orpo",
      "split": "development",
      "title": "ORPO: Monolithic Preference Optimization without Reference Model",
      "authors": [],
      "category": "preference",
      "source": {
        "arxivId": "2403.07691",
        "arxivVersion": "v1",
        "absUrl": "https://arxiv.org/abs/2403.07691v1",
        "pdfUrl": "https://arxiv.org/pdf/2403.07691v1",
        "paperRevisionDate": "2024-03-12",
        "repositoryUrl": "https://github.com/huggingface/alignment-handbook",
        "repositoryCommitSha": "1de1fc996972aa76b7d40c64c07b66dec8b6976a",
        "repositoryCommitDate": null,
        "paperSha256": null,
        "paperSha256Status": "PENDING_ACQUISITION",
        "artifactPolicy": "cache_only_no_redistribution",
        "temporalAlignment": "UNKNOWN"
      },
      "tasks": [
        {
          "taskId": "v2-orpo-task",
          "query": "Which preference-optimization method removes the reference model?",
          "expectedStatus": "SUPPORTED",
          "expectedAnswer": {
            "method": "odds ratio preference optimization"
          },
          "expectedSourceClass": [
            "paper"
          ],
          "expectedLocator": "paper evidence",
          "annotationRationale": "Independently curated bounded proposition for the new V2 corpus."
        }
      ]
    },
    {
      "caseId": "v2-deepseekmath",
      "split": "development",
      "title": "DeepSeekMath: Pushing the Limits of Mathematical Reasoning in Open Language Models",
      "authors": [],
      "category": "reasoning",
      "source": {
        "arxivId": "2402.03300",